"DESCRIPTION","DURATION IN MS","NAME","PARENT SUITE","START TIME","STATUS","STOP TIME","SUB SUITE","SUITE","TEST CLASS","TEST METHOD"
"","261","Sign Up page elements is visible","chromium","Wed Mar 05 19:17:46 GMT 2025","passed","Wed Mar 05 19:17:46 GMT 2025","Website elements is visible","tests.spec.ts","",""
"","323","Login page elements is visible","chromium","Wed Mar 05 19:17:45 GMT 2025","passed","Wed Mar 05 19:17:46 GMT 2025","Website elements is visible","tests.spec.ts","",""
"","310","Add Contact page elements is visible","chromium","Wed Mar 05 19:17:46 GMT 2025","passed","Wed Mar 05 19:17:47 GMT 2025","Website elements is visible","tests.spec.ts","",""
"","1710","User is able to Sign Up","chromium","Wed Mar 05 19:17:42 GMT 2025","passed","Wed Mar 05 19:17:44 GMT 2025","End to end tests","tests.spec.ts","",""
"","1367","User is able to Logout","chromium","Wed Mar 05 19:17:45 GMT 2025","passed","Wed Mar 05 19:17:46 GMT 2025","End to end tests","tests.spec.ts","",""
"","3070","User is able to Add a Contact on Contact Page","chromium","Wed Mar 05 19:17:42 GMT 2025","passed","Wed Mar 05 19:17:45 GMT 2025","End to end tests","tests.spec.ts","",""
"","1450","User is able to Login","chromium","Wed Mar 05 19:17:44 GMT 2025","passed","Wed Mar 05 19:17:45 GMT 2025","End to end tests","tests.spec.ts","",""
"","1439","Contacts page elements is visible","chromium","Wed Mar 05 19:17:46 GMT 2025","passed","Wed Mar 05 19:17:47 GMT 2025","Website elements is visible","tests.spec.ts","",""
