"DESCRIPTION","DURATION IN MS","NAME","PARENT SUITE","START TIME","STATUS","STOP TIME","SUB SUITE","SUITE","TEST CLASS","TEST METHOD"
"","416","Sign Up page elements is visible","chromium","Wed Mar 05 17:01:20 GMT 2025","passed","Wed Mar 05 17:01:20 GMT 2025","Website elements is visible","tests.spec.ts","",""
"","868","Add Contact page elements is visible","chromium","Wed Mar 05 17:01:20 GMT 2025","passed","Wed Mar 05 17:01:21 GMT 2025","Website elements is visible","tests.spec.ts","",""
"","1688","Contacts page elements is visible","chromium","Wed Mar 05 17:01:20 GMT 2025","failed","Wed Mar 05 17:01:22 GMT 2025","Website elements is visible","tests.spec.ts","",""
"","505","Login page elements is visible","chromium","Wed Mar 05 17:01:19 GMT 2025","passed","Wed Mar 05 17:01:20 GMT 2025","Website elements is visible","tests.spec.ts","",""
"","1446","User is able to Logout","chromium","Wed Mar 05 17:01:19 GMT 2025","passed","Wed Mar 05 17:01:20 GMT 2025","End to end tests","tests.spec.ts","",""
"","1904","User is able to Sign Up","chromium","Wed Mar 05 17:01:15 GMT 2025","passed","Wed Mar 05 17:01:17 GMT 2025","End to end tests","tests.spec.ts","",""
"","1524","User is able to Login","chromium","Wed Mar 05 17:01:17 GMT 2025","failed","Wed Mar 05 17:01:19 GMT 2025","End to end tests","tests.spec.ts","",""
"","3291","User is able to Add a Contact on Contact Page","chromium","Wed Mar 05 17:01:15 GMT 2025","passed","Wed Mar 05 17:01:18 GMT 2025","End to end tests","tests.spec.ts","",""
