"DESCRIPTION","DURATION IN MS","NAME","PARENT SUITE","START TIME","STATUS","STOP TIME","SUB SUITE","SUITE","TEST CLASS","TEST METHOD"
"","1481","User is able to Login","chromium","Wed Mar 05 18:34:53 GMT 2025","passed","Wed Mar 05 18:34:55 GMT 2025","End to end tests","tests.spec.ts","",""
"","5556","Contacts page elements is visible","chromium","Wed Mar 05 18:34:55 GMT 2025","failed","Wed Mar 05 18:35:01 GMT 2025","Website elements is visible","tests.spec.ts","",""
"","1822","User is able to Sign Up","chromium","Wed Mar 05 18:34:51 GMT 2025","passed","Wed Mar 05 18:34:53 GMT 2025","End to end tests","tests.spec.ts","",""
"","388","Login page elements is visible","chromium","Wed Mar 05 18:34:55 GMT 2025","passed","Wed Mar 05 18:34:55 GMT 2025","Website elements is visible","tests.spec.ts","",""
"","3199","User is able to Add a Contact on Contact Page","chromium","Wed Mar 05 18:34:51 GMT 2025","passed","Wed Mar 05 18:34:54 GMT 2025","End to end tests","tests.spec.ts","",""
"","1425","User is able to Logout","chromium","Wed Mar 05 18:34:54 GMT 2025","passed","Wed Mar 05 18:34:56 GMT 2025","End to end tests","tests.spec.ts","",""
"","362","Sign Up page elements is visible","chromium","Wed Mar 05 18:34:55 GMT 2025","passed","Wed Mar 05 18:34:55 GMT 2025","Website elements is visible","tests.spec.ts","",""
"","410","Add Contact page elements is visible","chromium","Wed Mar 05 18:34:56 GMT 2025","passed","Wed Mar 05 18:34:56 GMT 2025","Website elements is visible","tests.spec.ts","",""
